"variable","label","labelLong","variableType","databaseStart","variableStart","subject","section","units","notes","description","purpose","version","lastUpdated","reviewNotes","status","versionNotes","role","source"
"SurveyCycle","Survey cycle","CCHS survey cycle","Categorical","cchs2001_p, cchs2003_p, cchs2005_p, cchs2007_2008_p, cchs2009_2010_p, cchs2011_2012_p, cchs2013_2014_p, cchs2015_2016_p, cchs2017_2018_p, cchs2019_2020_p, cchs2022_p","DerivedVar::[data_name]","demographics","Sociodemographics","N/A",NA,"Derived from dataset name; identifies CCHS cycle for each respondent","Identifies the CCHS cycle for each respondent. Used to derive survey year for the period component of the APC model and to label cycle-specific results.","0.1.0","2026-06-11","","",NA,"design, table1-stratifier, imputation-predictor","both"
"DHHGAGE_cont","Age (grouped continuous, years)","Age - continuous","Continuous","cchs2001_p, cchs2003_p, cchs2005_p, cchs2007_2008_p, cchs2009_2010_p, cchs2011_2012_p, cchs2013_2014_p, cchs2015_2016_p, cchs2017_2018_p, cchs2019_2020_p, cchs2022_p","[DHH_AGE]","demographics","Sociodemographics","Years",NA,"Continuous age; preferred over DHHGAGE_A for APC model where available","Continuous age in years (midpoint-estimated in PUMF). The primary age input to the APC model. Cohort is derived as survey_year - age.","0.1.0","2026-06-11","","",NA,"predictor, table1, apc-denominator, imputation-predictor","pumf"
"DHH_SEX","Sex","Sex","Categorical","cchs2001_p, cchs2003_p, cchs2005_p, cchs2007_2008_p, cchs2009_2010_p, cchs2011_2012_p, cchs2013_2014_p, cchs2015_2016_p, cchs2017_2018_p, cchs2019_2020_p, cchs2022_p","cchs2001_p::DHHA_SEX, cchs2003_p::DHHA_SEX, cchs2005_p::DHHA_SEX, [DHH_SEX]","demographics","Sociodemographics","N/A",NA,"Sex (1=Male 2=Female). APC models run separately by sex","Sex. APC initiation and cessation models are fit separately for men and women because smoking trends differ substantially by sex. Also used to stratify Table 1.","0.1.0","2026-06-11","","",NA,"model-stratifier, table1, apc-denominator, table1-stratifier, imputation-predictor","pumf"
"GEOGPRV","Province of residence","Province of residence","Categorical","cchs2001_p, cchs2003_p, cchs2005_p, cchs2007_2008_p, cchs2009_2010_p, cchs2011_2012_p, cchs2013_2014_p, cchs2015_2016_p, cchs2017_2018_p, cchs2019_2020_p, cchs2022_p","[GEOGPRV]","demographics","Sociodemographics","N/A",NA,"Province/territory of residence. Used for provincial APC estimates","Province of residence. Used for provincial APC stratification (Stage 8 subgroup). Territories are pooled due to small sample sizes.","0.1.0","2026-06-11","","",NA,"predictor, table1, imputation-predictor","pumf"
"WTS_M","Master survey weight","Survey sampling weight","Continuous","cchs2001_p, cchs2003_p, cchs2005_p, cchs2007_2008_p, cchs2009_2010_p, cchs2011_2012_p, cchs2013_2014_p, cchs2015_2016_p, cchs2017_2018_p, cchs2019_2020_p, cchs2022_p","cchs2001_p::WTSAM, cchs2003_p::WTSC_M, cchs2005_p::WTSE_M, [WTS_M]","demographics","Sociodemographics","N/A",NA,"CCHS sampling weight. Required for all prevalence estimates and weighted APC models","Survey sampling weight. Applied in APC logistic regression as a case weight to produce nationally representative estimates.","0.1.0","2026-06-11","","",NA,"design, apc-denominator, imputation-predictor","pumf"
"SDCFIMM","Immigrant status (2007-2014 only)","Immigrant status (D)","Categorical","cchs2001_p, cchs2003_p, cchs2005_p, cchs2007_2008_p, cchs2009_2010_p, cchs2011_2012_p, cchs2013_2014_p, cchs2015_2016_p, cchs2017_2018_p","[SDCFIMM]","demographics","Sociodemographics","N/A",NA,"Immigrant status derived (1=non-immigrant 2=immigrant 3=non-permanent resident). Used in MPoRT mortality adjustment","Immigrant status. Used in the MPoRT mortality correction to adjust for survival bias. Only available 2007-2014.","0.1.0","2026-06-11","","",NA,"predictor, table1","pumf"
"SDCGCGT","Cultural/racial origin (2007-2014 only)","Cultural or racial origin (D/G)","Categorical","cchs2001_p, cchs2005_p, cchs2007_2008_p, cchs2009_2010_p, cchs2011_2012_p, cchs2013_2014_p, cchs2015_2016_p, cchs2017_2018_p","cchs2001_p::SDCA_COB, [SDCGCGT]","demographics","Sociodemographics","N/A",NA,"Cultural/racial origin. Not in all cycles (NA(c) where absent). Used for subgroup analysis; not a primary APC model variable","Cultural/racial origin. Retained for potential subgroup analyses. Only available in select cycles; will be NA(c) elsewhere.","0.1.0","2026-06-11","Not available all cycles","",NA,"predictor, table1","pumf"
"EDUDR03","Education (3-cat)","Highest education level - 3 categories","Categorical","cchs2001_p, cchs2003_p, cchs2005_p, cchs2007_2008_p, cchs2009_2010_p, cchs2011_2012_p, cchs2013_2014_p, cchs2015_2016_p, cchs2017_2018_p","[EDUDR03]","demographics","Sociodemographics","N/A",NA,"Highest education (3-category: less than high school / high school graduate / post-secondary). Used for subgroup analysis. cchsflow harmonized from EDUADR04/EDUCDR04/EDUEDR04/EHG2DVR3.","Education (3-category). Included for descriptive purposes and potential subgroup analysis. Not available in 2019-20 or 2022 PUMF.","0.1.0","2026-06-11","Not available 2019-20 or 2022","",NA,"predictor, table1, imputation-predictor","pumf"
"SMK_01A","Smoked 100+ cigs","Ever smoked 100 or more cigarettes in lifetime","Categorical","cchs2001_p, cchs2003_p, cchs2005_p, cchs2007_2008_p, cchs2009_2010_p, cchs2010_p, cchs2011_2012_p, cchs2012_p, cchs2013_2014_p, cchs2014_p, cchs2015_2016_p, cchs2017_2018_p, cchs2019_2020_p, cchs2022_p, cchs2023_p, cchs2001_m, cchs2003_m, cchs2005_m, cchs2007_2008_m, cchs2009_2010_m, cchs2009_m, cchs2010_m, cchs2011_2012_m, cchs2012_m, cchs2013_2014_m, cchs2014_m, cchs2015_2016_m, cchs2017_2018_m, cchs2019_2020_m, cchs2021_m, cchs2022_m, cchs2023_m","cchs2001_p::SMKA_01A, cchs2003_p::SMKC_01A, cchs2005_p::SMKE_01A, cchs2015_2016_p::SMK_020, cchs2017_2018_p::SMK_020, cchs2019_2020_p::SMK_020, cchs2022_p::CSS_15, cchs2023_p::CSS_15, cchs2001_m::SMKA_01A, cchs2003_m::SMKC_01A, cchs2005_m::SMKE_01A, cchs2015_2016_m::SMK_020, cchs2017_2018_m::SMK_020, cchs2019_2020_m::SMK_020, cchs2021_m::SMK_020, cchs2022_m::CSS_15, cchs2023_m::CSS_15, [SMK_01A]","smoking","Health behaviour","N/A",NA,"Gate question: ever smoked >=100 cigarettes lifetime. Combined with SMK_01B and SMK_202 for never/current/former classification","Intermediate: input to SMKDSTY_A derivation. Gate variable: ever smoked 100+ cigarettes. Combined with SMK_01B and SMK_202 to classify respondents as never/current/former smoker for the APC numerator.","0.1.0","2026-06-09","","","Synced to cchsflow v3 (smoking merged 2026-04-29, commit bd0df3ac)","intermediate","both"
"SMK_01B","Smoked 1 whole cig","Ever smoked a whole cigarette","Categorical","cchs2001_p, cchs2003_p, cchs2005_p, cchs2007_2008_p, cchs2009_2010_p, cchs2010_p, cchs2011_2012_p, cchs2012_p, cchs2013_2014_p, cchs2014_p, cchs2015_2016_p, cchs2017_2018_p, cchs2019_2020_p, cchs2022_p, cchs2023_p, cchs2001_m, cchs2003_m, cchs2005_m, cchs2007_2008_m, cchs2009_2010_m, cchs2009_m, cchs2010_m, cchs2011_2012_m, cchs2012_m, cchs2013_2014_m, cchs2014_m, cchs2015_2016_m, cchs2017_2018_m, cchs2019_2020_m, cchs2021_m, cchs2022_m, cchs2023_m","cchs2001_p::SMKA_01B, cchs2003_p::SMKC_01B, cchs2005_p::SMKE_01B, cchs2015_2016_p::SMK_025, cchs2017_2018_p::SMK_025, cchs2019_2020_p::SMK_025, cchs2022_p::CSS_05, cchs2023_p::CSS_05, cchs2001_m::SMKA_01B, cchs2003_m::SMKC_01B, cchs2005_m::SMKE_01B, cchs2015_2016_m::SMK_025, cchs2017_2018_m::SMK_025, cchs2019_2020_m::SMK_025, cchs2021_m::SMK_025, cchs2022_m::CSS_05, cchs2023_m::CSS_05, [SMK_01B]","smoking","Health behaviour","N/A",NA,"Second gate for never-smoker definition: never smoked a whole cigarette AND <100 lifetime cigarettes = never smoker","Intermediate: input to SMKDSTY_A derivation. Gate variable: ever smoked a whole cigarette. Used with SMK_01A to define never-smoker status.","0.1.0","2026-06-09","","","Synced to cchsflow v3 (smoking merged 2026-04-29, commit bd0df3ac)","intermediate","both"
"SMK_202","Smoking type","Type of smoker presently (daily/occasional/not at all)","Categorical","cchs2001_p, cchs2003_p, cchs2005_p, cchs2007_2008_p, cchs2009_2010_p, cchs2010_p, cchs2011_2012_p, cchs2012_p, cchs2013_2014_p, cchs2014_p, cchs2015_2016_p, cchs2017_2018_p, cchs2019_2020_p, cchs2001_m, cchs2003_m, cchs2005_m, cchs2007_2008_m, cchs2009_2010_m, cchs2009_m, cchs2010_m, cchs2011_2012_m, cchs2012_m, cchs2013_2014_m, cchs2014_m, cchs2015_2016_m, cchs2017_2018_m, cchs2019_2020_m, cchs2021_m","cchs2001_p::SMKA_202, cchs2003_p::SMKC_202, cchs2005_p::SMKE_202, cchs2015_2016_p::SMK_005, cchs2017_2018_p::SMK_005, cchs2019_2020_p::SMK_005, cchs2001_m::SMKA_202, cchs2003_m::SMKC_202, cchs2005_m::SMKE_202, cchs2015_2016_m::SMK_005, cchs2017_2018_m::SMK_005, cchs2019_2020_m::SMK_005, cchs2021_m::SMK_005, [SMK_202]","smoking","Health behaviour","N/A",NA,"Current smoking frequency. Combined with SMK_01A/SMK_01B to derive 3-category status: never / current / former","Intermediate: input to SMKDSTY_A derivation. Current smoking frequency (daily/occasional/not at all). Combined with SMK_01A/SMK_01B to derive 3-category smoking status.","0.1.0","2026-06-09","","","Synced to cchsflow v3 (smoking merged 2026-04-29, commit bd0df3ac)","intermediate","both"
"SMKDSTY_original","Smoking status (6-cat)","Type of smoker derived - 6-category (cchsflow v3, original StatCan scheme)","Categorical","cchs2001_p, cchs2003_p, cchs2005_p, cchs2007_2008_p, cchs2009_2010_p, cchs2010_p, cchs2011_2012_p, cchs2012_p, cchs2013_2014_p, cchs2014_p, cchs2015_2016_p, cchs2017_2018_p, cchs2019_2020_p, cchs2001_m, cchs2003_m, cchs2005_m, cchs2007_2008_m, cchs2009_2010_m, cchs2009_m, cchs2010_m, cchs2011_2012_m, cchs2012_m, cchs2013_2014_m, cchs2014_m, cchs2015_2016_m, cchs2017_2018_m, cchs2019_2020_m, cchs2021_m","cchs2001_p::SMKADSTY, cchs2003_p::SMKCDSTY, cchs2005_p::SMKEDSTY, cchs2007_2008_p::SMKDSTY, cchs2009_2010_p::SMKDSTY, cchs2010_p::SMKDSTY, cchs2011_2012_p::SMKDSTY, cchs2012_p::SMKDSTY, cchs2013_2014_p::SMKDSTY, cchs2001_m::SMKADSTY, cchs2003_m::SMKCDSTY, cchs2005_m::SMKEDSTY, cchs2007_2008_m::SMKDSTY, cchs2009_2010_m::SMKDSTY, cchs2009_m::SMKDSTY, cchs2010_m::SMKDSTY, cchs2011_2012_m::SMKDSTY, cchs2012_m::SMKDSTY, cchs2013_2014_m::SMKDSTY, cchs2014_m::SMKDSTY, DerivedVar::[SMK_202, SMK_05D, SMK_01A]","smoking","Health behaviour","N/A",NA,"cchsflow v3 harmonized 6-cat smoking status: 1=daily, 2=occ(fmr daily), 3=always occasional, 4=former daily, 5=former occasional, 6=never. Consistent categories across all cycles.","Primary smoking classification for APC numerator construction and Table 1. cchsflow v3: 2001-2014 pass-through from SMKDSTY; 2015-2021 derived from SMK_202, SMK_05D, SMK_01A. Not supported PUMF 2022/2023.","0.1.0","2026-06-11","Renamed from SMKDSTY_A per CEP-002 year-based naming","","Synced to cchsflow v3 (smoking merged 2026-04-29, commit bd0df3ac)","predictor, table1, apc-numerator, imputation-predictor","both"
"age_first_cigarette","Age 1st cig (unified)*","Age smoked first whole cigarette - unified (cchsflow v3)","Continuous","cchs2001_p, cchs2003_p, cchs2005_p, cchs2007_2008_p, cchs2009_2010_p, cchs2010_p, cchs2011_2012_p, cchs2012_p, cchs2013_2014_p, cchs2014_p, cchs2015_2016_p, cchs2017_2018_p, cchs2019_2020_p, cchs2001_m, cchs2003_m, cchs2005_m, cchs2007_2008_m, cchs2009_2010_m, cchs2009_m, cchs2010_m, cchs2011_2012_m, cchs2012_m, cchs2013_2014_m, cchs2014_m, cchs2015_2016_m, cchs2017_2018_m, cchs2019_2020_m, cchs2021_m, cchs2022_m, cchs2023_m","DerivedVar::[SMKG01C_cont, SMK_01C]","smoking","Health behaviour","Years","Unified variable (cchsflow v3). Universe: ever smoked 100+ cigarettes. Priority: SMK_01C (Master exact) > SMKG01C_cont (PUMF midpoint). PUMF 2001-2021; Master 2001-2023.","Unified variable (cchsflow v3 PR #163). Master: exact age (SMK_01C); PUMF: midpoint-estimated (SMKG01C_cont). Primary initiation age input","Age at first whole cigarette (unified cchsflow v3 variable). Primary input for the initiation APC numerator. Routes to exact values (Master) or midpoint estimates (PUMF) automatically.","0.1.0","2026-06-11","Synced to cchsflow v3 (smoking merged 2026-04-29, commit bd0df3ac)","","Synced to cchsflow v3 (smoking merged 2026-04-29, commit bd0df3ac)","predictor, table1, apc-numerator, imputation-predictor","both"
"age_start_smoking","Age daily (unified)*","Age started smoking daily - unified (cchsflow v3)","Continuous","cchs2001_p, cchs2003_p, cchs2005_p, cchs2007_2008_p, cchs2009_2010_p, cchs2010_p, cchs2011_2012_p, cchs2012_p, cchs2013_2014_p, cchs2014_p, cchs2015_2016_p, cchs2017_2018_p, cchs2001_m, cchs2003_m, cchs2005_m, cchs2007_2008_m, cchs2009_2010_m, cchs2009_m, cchs2010_m, cchs2011_2012_m, cchs2012_m, cchs2013_2014_m, cchs2014_m, cchs2015_2016_m, cchs2017_2018_m, cchs2019_2020_m, cchs2021_m, cchs2022_m, cchs2023_m","DerivedVar::[SMKG040_cont, SMK_040]","smoking","Health behaviour","Years","Raw SMKG040 absent from 2019-20 PUMF (DDI-confirmed): age_start_smoking unavailable for cchs2019_2020_p and cchs2022_p; Master covers 2001-2023. See cchsflow#185.","Unified variable (cchsflow v3 PR #163). Master: exact age (SMK_040); PUMF: midpoint-estimated (SMKG040_cont). Primary daily initiation age","Age started smoking daily (unified cchsflow v3 variable). Used in the initiation APC model as an alternative or supplementary age measure.","0.1.0","2026-06-11","Synced to cchsflow v3 (smoking merged 2026-04-29, commit bd0df3ac)","","Synced to cchsflow v3 (smoking merged 2026-04-29, commit bd0df3ac)","predictor, table1, apc-numerator, imputation-predictor","both"
"time_quit_smoking_daily","Yrs quit daily (unified)*","Years since stopped smoking daily - unified (cchsflow v3)","Continuous","cchs2001_p, cchs2003_p, cchs2005_p, cchs2007_2008_p, cchs2009_2010_p, cchs2010_p, cchs2011_2012_p, cchs2012_p, cchs2013_2014_p, cchs2014_p, cchs2015_2016_p, cchs2017_2018_p, cchs2019_2020_p, cchs2001_m, cchs2003_m, cchs2005_m, cchs2007_2008_m, cchs2009_2010_m, cchs2009_m, cchs2010_m, cchs2011_2012_m, cchs2012_m, cchs2013_2014_m, cchs2014_m, cchs2015_2016_m, cchs2017_2018_m, cchs2019_2020_m, cchs2021_m, cchs2023_m","DerivedVar::[SMKDSTY_cat5, SMK_09A_cont, SMK_09C]","smoking","Health behaviour","Years","Unified variable (cchsflow v3). Universe: former daily smokers. DerivedVar::[SMKDSTY_cat5, SMK_09A_cont, SMK_09C]: Master priority via SMK_09C exact years; PUMF fallback via SMK_09A_cont midpoint. Not supported 2022 or PUMF 2023.","Unified variable (cchsflow v3). PUMF: midpoint from SMK_09A_cont; Master: exact from SMK_09C. Former daily smokers only.","Primary input for the cessation APC numerator. Covers former daily smokers.","0.1.0","2026-06-11","Synced to cchsflow v3 (smoking merged 2026-04-29, commit bd0df3ac)","","Synced to cchsflow v3 (smoking merged 2026-04-29, commit bd0df3ac)","predictor, table1, apc-numerator, imputation-predictor","both"
"SMK_09A_cont","Yrs quit daily (PUMF)","Years since stopped smoking daily - former daily (PUMF continuous)","Continuous","cchs2001_p, cchs2003_p, cchs2005_p, cchs2007_2008_p, cchs2009_2010_p, cchs2010_p, cchs2011_2012_p, cchs2012_p, cchs2013_2014_p, cchs2014_p, cchs2015_2016_p, cchs2017_2018_p, cchs2019_2020_p, cchs2001_m, cchs2003_m, cchs2005_m, cchs2007_2008_m, cchs2009_2010_m, cchs2009_m, cchs2010_m, cchs2011_2012_m, cchs2012_m, cchs2013_2014_m, cchs2014_m, cchs2015_2016_m, cchs2017_2018_m, cchs2019_2020_m, cchs2021_m, cchs2023_m","cchs2001_p::SMKA_09A, cchs2003_p::SMKC_09A, cchs2005_p::SMKE_09A, cchs2015_2016_p::SMK_080, cchs2017_2018_p::SMK_080, cchs2019_2020_p::SMK_080, cchs2001_m::SMKA_09A, cchs2003_m::SMKC_09A, cchs2005_m::SMKE_09A, cchs2015_2016_m::SMK_080, cchs2017_2018_m::SMK_080, cchs2019_2020_m::SMK_080, cchs2021_m::SMK_080, cchs2023_m::SPU_25, [SMK_09A]","smoking","Health behaviour","Years","Midpoint-imputed years since quit, former daily smokers. Feeder for time_quit_smoking and time_quit_smoking_daily (cchsflow v3). Not available 2022 or PUMF 2023 (SPU_25 is Master-only).","PUMF-derived continuous years since quit. Superseded by time_quit_smoking once cchsflow v3 merges. Keep for pre-v3 fallback","Intermediate: PUMF/Master midpoint feeder for the unified cessation variables.","0.1.0","2026-06-09","","","Synced to cchsflow v3 (smoking merged 2026-04-29, commit bd0df3ac)","intermediate","both"
"SMK_06A_cont","Yrs quit occ (PUMF)","Years since stopped smoking - former occasional smokers (PUMF continuous)","Continuous","cchs2001_p, cchs2003_p, cchs2005_p, cchs2007_2008_p, cchs2009_2010_p, cchs2010_p, cchs2011_2012_p, cchs2012_p, cchs2013_2014_p, cchs2014_p, cchs2015_2016_p, cchs2017_2018_p, cchs2019_2020_p, cchs2001_m, cchs2003_m, cchs2005_m, cchs2007_2008_m, cchs2009_2010_m, cchs2009_m, cchs2010_m, cchs2011_2012_m, cchs2012_m, cchs2013_2014_m, cchs2014_m, cchs2015_2016_m, cchs2017_2018_m, cchs2019_2020_m, cchs2021_m, cchs2023_m","cchs2001_p::SMKA_06A, cchs2003_p::SMKC_06A, cchs2005_p::SMKE_06A, cchs2015_2016_p::SMK_060, cchs2017_2018_p::SMK_060, cchs2019_2020_p::SMK_060, cchs2001_m::SMKA_06A, cchs2003_m::SMKC_06A, cchs2005_m::SMKE_06A, cchs2015_2016_m::SMK_060, cchs2017_2018_m::SMK_060, cchs2019_2020_m::SMK_060, cchs2021_m::SMK_060, cchs2023_m::SPU_10, [SMK_06A]","smoking","Health behaviour","Years","Midpoint-imputed years since quit, former occasional smokers. Feeder for time_quit_smoking (cchsflow v3 falls back to it when SMK_09A_cont is not applicable). Not available 2022 or PUMF 2023.","PUMF-derived years since quit for former occasional smokers. Not covered by time_quit_smoking (daily only)","Intermediate: occasional-smoker feeder for time_quit_smoking (all former smokers).","0.1.0","2026-06-09","","","Synced to cchsflow v3 (smoking merged 2026-04-29, commit bd0df3ac)","intermediate","both"
"SMKDGSTP_cont","Yrs since quit (all)","Years since quit smoking completely - all former smokers (continuous)","Continuous","cchs2003_p, cchs2005_p, cchs2007_2008_p, cchs2009_2010_p, cchs2010_p, cchs2011_2012_p, cchs2012_p, cchs2013_2014_p, cchs2014_p, cchs2015_2016_p, cchs2017_2018_p, cchs2019_2020_p, cchs2003_m, cchs2005_m, cchs2007_2008_m, cchs2009_2010_m, cchs2009_m, cchs2010_m, cchs2011_2012_m, cchs2012_m, cchs2013_2014_m, cchs2014_m, cchs2015_2016_m, cchs2017_2018_m, cchs2019_2020_m, cchs2021_m, cchs2022_m, cchs2023_m","cchs2003_p::SMKCGSTP, cchs2005_p::SMKEGSTP, cchs2007_2008_p::SMKGSTP, cchs2009_2010_p::SMKGSTP, cchs2010_p::SMKGSTP, cchs2011_2012_p::SMKGSTP, cchs2012_p::SMKGSTP, cchs2013_2014_p::SMKGSTP, cchs2003_m::SMKCDSTP, cchs2005_m::SMKEDSTP, cchs2007_2008_m::SMKDSTP, cchs2009_2010_m::SMKDSTP, cchs2009_m::SMKDSTP, cchs2010_m::SMKDSTP, cchs2011_2012_m::SMKDSTP, cchs2012_m::SMKDSTP, cchs2013_2014_m::SMKDSTP, cchs2014_m::SMKDSTP, cchs2015_2016_m::SMKDVSTP, cchs2017_2018_m::SMKDVSTP, cchs2019_2020_m::SMKDVSTP, cchs2021_m::SMKDVSTP, cchs2022_m::SMKDVSTP, cchs2023_m::SMKDVSTP, [SMKDGSTP]","smoking","Health behaviour","Years",NA,"StatCan derived continuous years since quit (all former smokers). Available 2009+. Preferred where available; cross-validate with SMK_09A_cont","StatsCan derived years since quit (all former smokers). Available from 2007 onward. Cross-validates SMK_09A_cont estimates.","0.1.0","2026-06-09","","","Synced to cchsflow v3 (smoking merged 2026-04-29, commit bd0df3ac)","intermediate","both"
"SMK_204","Cigs/day (current)","Number of cigarettes smoked daily - current daily smokers","Continuous","cchs2001_p, cchs2003_p, cchs2005_p, cchs2007_2008_p, cchs2009_2010_p, cchs2010_p, cchs2011_2012_p, cchs2012_p, cchs2013_2014_p, cchs2014_p, cchs2015_2016_p, cchs2017_2018_p, cchs2019_2020_p, cchs2022_p, cchs2023_p, cchs2001_m, cchs2003_m, cchs2005_m, cchs2007_2008_m, cchs2009_2010_m, cchs2009_m, cchs2010_m, cchs2011_2012_m, cchs2012_m, cchs2013_2014_m, cchs2014_m, cchs2015_2016_m, cchs2017_2018_m, cchs2019_2020_m, cchs2021_m, cchs2022_m, cchs2023_m","cchs2001_p::SMKA_204, cchs2003_p::SMKC_204, cchs2005_p::SMKE_204, cchs2015_2016_p::SMK_045, cchs2017_2018_p::SMK_045, cchs2019_2020_p::SMK_045, cchs2022_p::CSS_25, cchs2023_p::CSS_25, cchs2001_m::SMKA_204, cchs2003_m::SMKC_204, cchs2005_m::SMKE_204, cchs2015_2016_m::SMK_045, cchs2017_2018_m::SMK_045, cchs2019_2020_m::SMK_045, cchs2021_m::SMK_045, cchs2022_m::CSS_25, cchs2023_m::CSS_25, [SMK_204]","smoking","Health behaviour","Cigarettes/day",NA,"Smoking intensity - current daily smokers. Input to intensity (CPD) model","Cigarettes per day for current daily smokers. Input to smoking intensity descriptive tables and future intensity model.","0.1.0","2026-06-09","","","Synced to cchsflow v3 (smoking merged 2026-04-29, commit bd0df3ac)","intermediate","both"
"SMK_208","Cigs/day (former)","Number of cigarettes smoked daily - former daily smokers","Continuous","cchs2001_p, cchs2003_p, cchs2005_p, cchs2007_2008_p, cchs2009_2010_p, cchs2010_p, cchs2011_2012_p, cchs2012_p, cchs2013_2014_p, cchs2014_p, cchs2015_2016_p, cchs2017_2018_p, cchs2019_2020_p, cchs2001_m, cchs2003_m, cchs2005_m, cchs2007_2008_m, cchs2009_2010_m, cchs2009_m, cchs2010_m, cchs2011_2012_m, cchs2012_m, cchs2013_2014_m, cchs2014_m, cchs2015_2016_m, cchs2017_2018_m, cchs2019_2020_m, cchs2021_m, cchs2022_m, cchs2023_m","cchs2001_p::SMKA_208, cchs2003_p::SMKC_208, cchs2005_p::SMKE_208, cchs2015_2016_p::SMK_075, cchs2017_2018_p::SMK_075, cchs2019_2020_p::SMK_075, cchs2001_m::SMKA_208,  cchs2003_m::SMKC_208, cchs2005_m::SMKE_208, cchs2015_2016_m::SMK_075, cchs2017_2018_m::SMK_075, cchs2019_2020_m::SMK_075, cchs2021_m::SMK_075, cchs2022_m::SPU_20, cchs2023_m::SPU_20, [SMK_208]","smoking","Health behaviour","Cigarettes/day",NA,"Smoking intensity - former daily smokers (peak CPD while smoking). Input to intensity model","Cigarettes per day for former daily smokers (peak while smoking). Input to smoking intensity descriptive tables.","0.1.0","2026-06-09","","","Synced to cchsflow v3 (smoking merged 2026-04-29, commit bd0df3ac)","intermediate","both"
"SMKG01C_cont","Age first cigarette (PUMF grouped)","","Continuous","cchs2001_p, cchs2003_p, cchs2005_p, cchs2007_2008_p, cchs2009_2010_p, cchs2010_p, cchs2011_2012_p, cchs2012_p, cchs2013_2014_p, cchs2014_p, cchs2015_2016_p, cchs2017_2018_p, cchs2019_2020_p, cchs2022_p, cchs2023_p, cchs2001_m, cchs2003_m, cchs2005_m, cchs2007_2008_m, cchs2009_2010_m, cchs2009_m, cchs2010_m, cchs2011_2012_m, cchs2012_m, cchs2013_2014_m, cchs2014_m, cchs2015_2016_m, cchs2017_2018_m, cchs2019_2020_m, cchs2021_m, cchs2022_m, cchs2023_m","cchs2001_p::SMKAG01C, cchs2003_p::SMKCG01C, cchs2005_p::SMKEG01C, cchs2015_2016_p::SMKG035, cchs2017_2018_p::SMKG035, cchs2019_2020_p::SMKG035, cchs2022_p::CSS_10, cchs2023_p::CSS_10, cchs2001_m::SMKA_01C, cchs2003_m::SMKC_01C, cchs2005_m::SMKE_01C, cchs2007_2008_m::SMK_01C, cchs2009_2010_m::SMK_01C, cchs2009_m::SMK_01C, cchs2010_m::SMK_01C, cchs2011_2012_m::SMK_01C, cchs2012_m::SMK_01C, cchs2013_2014_m::SMK_01C, cchs2014_m::SMK_01C, cchs2015_2016_m::SMK_035, cchs2017_2018_m::SMK_035, cchs2019_2020_m::SMK_035, cchs2021_m::SMK_035, cchs2022_m::CSS_10, cchs2023_m::CSS_10, [SMKG01C]","smoking","Health behaviour","Years",NA,"PUMF grouped age first cigarette (recoded to midpoints). Intermediate input to age_first_cigarette (cchsflow v3).","Intermediate: PUMF grouped age first cigarette recoded to midpoints. Required by cchsflow v3 to compute age_first_cigarette.","0.1.0","2026-06-09","","active","Synced to cchsflow v3 (smoking merged 2026-04-29, commit bd0df3ac)","intermediate","both"
"SMKG040_cont","Age started daily smoking (PUMF grouped)","","Continuous","cchs2001_p, cchs2003_p, cchs2005_p, cchs2007_2008_p, cchs2009_2010_p, cchs2010_p, cchs2011_2012_p, cchs2012_p, cchs2013_2014_p, cchs2014_p, cchs2015_2016_p, cchs2017_2018_p, cchs2001_m, cchs2003_m, cchs2005_m, cchs2007_2008_m, cchs2009_2010_m, cchs2009_m, cchs2010_m, cchs2011_2012_m, cchs2012_m, cchs2013_2014_m, cchs2014_m, cchs2015_2016_m, cchs2017_2018_m, cchs2019_2020_m, cchs2021_m, cchs2022_m, cchs2023_m","cchs2001_p::[SMKG203_pre2005, SMKG207_pre2005], cchs2003_p::[SMKG203_pre2005, SMKG207_pre2005], cchs2005_p::[SMKG203_2005plus, SMKG207_2005plus], cchs2007_2008_p::[SMKG203_2005plus, SMKG207_2005plus], cchs2009_2010_p::[SMKG203_2005plus, SMKG207_2005plus], cchs2010_p::[SMKG203_2005plus, SMKG207_2005plus], cchs2011_2012_p::[SMKG203_2005plus, SMKG207_2005plus], cchs2012_p::[SMKG203_2005plus, SMKG207_2005plus], cchs2013_2014_p::[SMKG203_2005plus, SMKG207_2005plus], cchs2014_p::[SMKG203_2005plus, SMKG207_2005plus], cchs2001_m::[SMK_203, SMK_207], cchs2003_m::[SMK_203, SMK_207], cchs2005_m::[SMK_203, SMK_207], cchs2007_2008_m::[SMK_203, SMK_207], cchs2009_2010_m::[SMK_203, SMK_207], cchs2009_m::[SMK_203, SMK_207], cchs2010_m::[SMK_203, SMK_207], cchs2011_2012_m::[SMK_203, SMK_207], cchs2012_m::[SMK_203, SMK_207], cchs2013_2014_m::[SMK_203, SMK_207], cchs2014_m::[SMK_203, SMK_207], cchs2015_2016_m::SMK_040, cchs2017_2018_m::SMK_040, cchs2019_2020_m::SMK_040, cchs2021_m::SMK_040, cchs2022_m::SPU_15, cchs2023_m::SPU_15, [SMKG040]","smoking","Health behaviour","Years",NA,"PUMF grouped age started daily smoking (recoded to midpoints). Intermediate input to age_start_smoking (cchsflow v3).","Intermediate: PUMF grouped age started daily smoking recoded to midpoints. Required by cchsflow v3 to compute age_start_smoking.","0.1.0","2026-06-10","","active","Synced to cchsflow v3 (smoking merged 2026-04-29, commit bd0df3ac)","intermediate","both"
